{
 "meta": {
  "schema_version": "1.0",
  "catalog_id": "cgi-demo",
  "generated_at": "2026-10-22T03:27:30Z",
  "generated_by": "site/tools/build_demo_catalog.py",
  "data_basis": [
   "PR #6 reports/data/samasound-samamusic-sample.csv (공개 샘플, 시연 초기 데이터)",
   "PR #12 reports/samples/product_master_sample.csv (상품 마스터 보강, 선택)",
   "PR #12 reports/samples/category_catalog_sample.csv (카테고리 카탈로그, 선택)"
  ],
  "site_name": "CGI 상품 카탈로그",
  "site_owner": "CGI (김범신)",
  "disclaimer": [
   "수집된 전체 상품과 CGI 실제 판매 승인 상품은 서로 다른 집합입니다.",
   "표시 가격은 원본 공개 페이지의 참고용 공개가이며 CGI 판매가가 아닙니다.",
   "공급가·재고·판매가는 미확정이며 추정 금액을 표시하지 않습니다.",
   "네이버 스마트스토어 개설 전이므로 주문·결제 기능이 없습니다."
  ],
  "brand_statement": "CGI 자체 브랜드이며 삼아스토어/삼아사운드의 상표·로고·화면을 복제하지 않습니다."
 },
 "categories": [
  {
   "id": "1152",
   "name": "프로모션 보기",
   "parent_id": "",
   "level": 0,
   "path": "프로모션 보기",
   "product_count": 0,
   "list_url": "https://www.samamusic.co.kr/product/list.html?cate_no=1152"
  },
  {
   "id": "24",
   "name": "브랜드",
   "parent_id": "",
   "level": 0,
   "path": "브랜드",
   "product_count": 0,
   "list_url": "https://www.samamusic.co.kr/product/list.html?cate_no=24"
  },
  {
   "id": "84",
   "name": "마이크",
   "parent_id": "",
   "level": 0,
   "path": "마이크",
   "product_count": 0,
   "list_url": "https://www.samamusic.co.kr/product/list.html?cate_no=84"
  },
  {
   "id": "42",
   "name": "스피커",
   "parent_id": "",
   "level": 0,
   "path": "스피커",
   "product_count": 7,
   "list_url": "https://www.samamusic.co.kr/product/list.html?cate_no=42"
  },
  {
   "id": "25",
   "name": "이어폰/헤드폰",
   "parent_id": "",
   "level": 0,
   "path": "이어폰/헤드폰",
   "product_count": 0,
   "list_url": "https://www.samamusic.co.kr/product/list.html?cate_no=25"
  },
  {
   "id": "28",
   "name": "레코딩/음향",
   "parent_id": "",
   "level": 0,
   "path": "레코딩/음향",
   "product_count": 0,
   "list_url": "https://www.samamusic.co.kr/product/list.html?cate_no=28"
  },
  {
   "id": "379",
   "name": "악기/앰프",
   "parent_id": "",
   "level": 0,
   "path": "악기/앰프",
   "product_count": 1,
   "list_url": "https://www.samamusic.co.kr/product/list.html?cate_no=379"
  },
  {
   "id": "1038",
   "name": "Hi-Fi",
   "parent_id": "",
   "level": 0,
   "path": "Hi-Fi",
   "product_count": 0,
   "list_url": "https://www.samamusic.co.kr/product/list.html?cate_no=1038"
  },
  {
   "id": "366",
   "name": "케이블/커넥터",
   "parent_id": "",
   "level": 0,
   "path": "케이블/커넥터",
   "product_count": 1,
   "list_url": "https://www.samamusic.co.kr/product/list.html?cate_no=366"
  },
  {
   "id": "758",
   "name": "소프트웨어",
   "parent_id": "",
   "level": 0,
   "path": "소프트웨어",
   "product_count": 0,
   "list_url": "https://www.samamusic.co.kr/product/list.html?cate_no=758"
  },
  {
   "id": "97",
   "name": "특가상품",
   "parent_id": "",
   "level": 0,
   "path": "특가상품",
   "product_count": 0,
   "list_url": "https://www.samamusic.co.kr/product/list.html?cate_no=97"
  }
 ],
 "brands": [
  {
   "name": "Shure",
   "count": 9
  },
  {
   "name": "Genelec",
   "count": 7
  },
  {
   "name": "PRESONUS",
   "count": 5
  },
  {
   "name": "Antares",
   "count": 2
  },
  {
   "name": "Klotz",
   "count": 2
  },
  {
   "name": "NEUTRIK",
   "count": 2
  },
  {
   "name": "APOGEE",
   "count": 1
  },
  {
   "name": "ARTURIA",
   "count": 1
  },
  {
   "name": "HK Audio",
   "count": 1
  },
  {
   "name": "Michael Tuttle Guitars",
   "count": 1
  },
  {
   "name": "NASH GUITARS",
   "count": 1
  },
  {
   "name": "Q Acoustics",
   "count": 1
  },
  {
   "name": "QED",
   "count": 1
  },
  {
   "name": "RADIAL",
   "count": 1
  },
  {
   "name": "자체제작",
   "count": 1
  }
 ],
 "products": [
  {
   "id": "samamusic.co.kr:1120",
   "source_site": "samamusic.co.kr",
   "source_site_label": "삼아스토어 (samamusic.co.kr)",
   "source_product_id": "1120",
   "source_category_id": "42",
   "source_category_path": "스피커",
   "brand": "Genelec",
   "model": "8030CW",
   "product_name": "GENELEC 8030C 제네렉 스튜디오 모니터 스피커 (화이트)",
   "summary": "Classic Studio Monitors 12.7cm (5타입)",
   "manufacturer": "",
   "country_of_origin": "유럽 핀란드",
   "canonical_url": "https://www.samamusic.co.kr/product/detail.html?product_no=1120&cate_no=42&display_group=1",
   "source_list_url": "",
   "specs": {
    "상품명": "GENELEC 8030C 제네렉 스튜디오 모니터 스피커 (화이트)",
    "판매가": "1,190,000원",
    "브랜드": "Genelec",
    "모델명": "8030CW",
    "안전확인신고번호": "공급자적합성확인대상제품",
    "적합인증번호": "MSIP-REI-SPS-8030C",
    "상품요약정보": "본 가격은 스피커 1통 가격입니다",
    "상품간략설명": "Classic Studio Monitors 12.7cm (5타입)",
    "원산지": "유럽 핀란드"
   },
   "options": [],
   "bundled_items": [],
   "image_urls": [
    "https://www.samamusic.co.kr/web/product/small/201808/bc9e8aa7aa8909a98be54bbff3f49c41.jpg",
    "https://www.samamusic.co.kr/web/product/extra/small/201808/dfc9bfc1a0cb8eb0f25966ce4254da60.jpg",
    "https://www.samamusic.co.kr/web/product/extra/small/201808/14c125628c71f14a5c0bfed21ce32152.jpg",
    "https://www.samamusic.co.kr/web/product/extra/small/201808/340e86561aaca3619d3a6ae8b498bb96.jpg",
    "https://www.samamusic.co.kr/web/product/extra/small/201808/ff1a1c1b72377235625a06e68fdca046.jpg"
   ],
   "image": "https://www.samamusic.co.kr/web/product/small/201808/bc9e8aa7aa8909a98be54bbff3f49c41.jpg",
   "published_price": 1190000,
   "published_price_text": "1,190,000",
   "published_price_state": "public",
   "availability": "",
   "review_count": "",
   "extraction_method": "HTTP/HTML(detail)+file:sitemap.xml",
   "verification_status": "detail_page_verified",
   "source_evidence": "detail=https://www.samamusic.co.kr/product/detail.html?product_no=1120&cate_no=42&display_group=1 || file:sitemap.xml#1120 -> https://samastore.co.kr/product/genelec-8030c-제네렉-스튜디오-모니터-스피커-화이트/1120/",
   "updated_at": "2026-10-22T00:00:00+09:00 (수집일)",
   "cgi_sale_status": "unapproved",
   "cgi_sale_note": "CGI 취급 범위 확인 전 — 참고용 수집 정보",
   "cgi_dealer_price": null,
   "cgi_dealer_price_state": "unconfirmed",
   "cgi_stock": null,
   "cgi_stock_state": "unconfirmed",
   "naver_smartstore_mapping": {
    "ready": false,
    "product_name": "GENELEC 8030C 제네렉 스튜디오 모니터 스피커 (화이트)",
    "category_id": null,
    "option_type": null,
    "price": null,
    "stock": null,
    "image_urls": [],
    "memo": "스마트스토어 개설 후 확정 매핑 (Issue #11 §4)"
   }
  },
  {
   "id": "samamusic.co.kr:974",
   "source_site": "samamusic.co.kr",
   "source_site_label": "삼아스토어 (samamusic.co.kr)",
   "source_product_id": "974",
   "source_category_id": "26",
   "source_category_path": "레코딩",
   "brand": "PRESONUS",
   "model": "Eris 3.5 GEN2",
   "product_name": "PreSonus Eris 3.5 GEN2 프리소너스 에리스 2세대 모니터 스피커 1조(2통)",
   "summary": "본 가격은 스피커 1조(2통)에 대한 가격입니다",
   "manufacturer": "",
   "country_of_origin": "아시아 중국",
   "canonical_url": "https://www.samamusic.co.kr/product/detail.html?product_no=974&cate_no=42&display_group=1",
   "source_list_url": "https://www.samamusic.co.kr/product/detail.html?product_no=974&cate_no=26&display_group=1",
   "specs": {
    "상품명": "PreSonus Eris 3.5 GEN2 프리소너스 에리스 2세대 모니터 스피커 1조(2통)",
    "판매가": "219,000원",
    "브랜드": "PRESONUS",
    "모델명": "Eris 3.5 GEN2",
    "안전확인신고번호": "공급자적합성확인대상제품",
    "적합인증번호": "R-R-YPS-Eris3-5",
    "상품요약정보": "본 가격은 스피커 1조(2통)에 대한 가격입니다",
    "상품간략설명": "국민스피커 ERIS, 2세대 2웨이 8.89cm (3.5타입) 미디어 레퍼런스 모니터 스피커",
    "원산지": "아시아 중국",
    "구매방법": "1회구매 정기배송 할인",
    "길이 선택": "- [필수] 옵션을 선택해 주세요 - ------------------- 1.5m 2m (+3,000원) 3m (+6,000원) 4m (+10,000원) 5m [품절] (+14,000원)",
    "길이선택": "- [필수] 옵션을 선택해 주세요 - ------------------- 1m 2m (+3,000원) 3m (+6,000원) 6m (+12,000원)",
    "배송비": "3,000원 (50,000원 이상 구매 시 무료)",
    "배송주기": "정기배송 할인 save 결제 시 : 할인",
    "수량": ""
   },
   "options": [
    {
     "name": "길이선택",
     "option_type": "T",
     "item_codes": [
      "P0000CKZ000A",
      "P0000CKZ000B",
      "P0000CKZ000C",
      "P0000CKZ000D"
     ],
     "values": [
      {
       "label": "1m",
       "add_price": null,
       "sold_out": false,
       "item_code": "P0000CKZ000A"
      },
      {
       "label": "2m",
       "add_price": 3000,
       "sold_out": false,
       "item_code": "P0000CKZ000B"
      },
      {
       "label": "3m",
       "add_price": 6000,
       "sold_out": false,
       "item_code": "P0000CKZ000C"
      },
      {
       "label": "6m",
       "add_price": 12000,
       "sold_out": false,
       "item_code": "P0000CKZ000D"
      }
     ],
     "values_uncertain": false
    },
    {
     "name": "길이선택",
     "option_type": "T",
     "item_codes": [
      "P0000CLA000A",
      "P0000CLA000B",
      "P0000CLA000C"
     ],
     "values": [
      {
       "label": "1m",
       "add_price": null,
       "sold_out": false,
       "item_code": "P0000CLA000A"
      },
      {
       "label": "2m",
       "add_price": 2000,
       "sold_out": false,
       "item_code": "P0000CLA000B"
      },
      {
       "label": "3m",
       "add_price": 5000,
       "sold_out": false,
       "item_code": "P0000CLA000C"
      }
     ],
     "values_uncertain": false
    },
    {
     "name": "길이 선택",
     "option_type": "T",
     "item_codes": [
      "P0000EXR000A",
      "P0000EXR000D",
      "P0000EXR000B",
      "P0000EXR000E",
      "P0000EXR000C"
     ],
     "values": [
      {
       "label": "1.5m",
       "add_price": null,
       "sold_out": false,
       "item_code": "P0000EXR000A"
      },
      {
       "label": "2m",
       "add_price": 3000,
       "sold_out": false,
       "item_code": "P0000EXR000D"
      },
      {
       "label": "3m",
       "add_price": 6000,
       "sold_out": false,
       "item_code": "P0000EXR000B"
      },
      {
       "label": "4m",
       "add_price": 10000,
       "sold_out": false,
       "item_code": "P0000EXR000E"
      },
      {
       "label": "5m",
       "add_price": 14000,
       "sold_out": true,
       "item_code": "P0000EXR000C"
      }
     ],
     "values_uncertain": false
    }
   ],
   "bundled_items": [
    {
     "name": "KLOTZ AY7 클로츠 Lightweight Y 케이블 (3.5 TRS ㅡ자 to 2x RCA)",
     "price_text": "19,000원",